{
  "bundle_id": "mindspore.ops.randn",
  "bundle_type": "entry",
  "schema_version": "v2",
  "generated_at": "2026-04-20T17:24:10+08:00",
  "entry": {
    "public_api": "mindspore.ops.randn",
    "public_surface": "mindspore.ops",
    "public_name": "randn",
    "entry_type": "single",
    "source_type": "wrapper",
    "source_path": "mindspore/python/mindspore/ops/function/__init__.py"
  },
  "branches": [
    {
      "route_type": "direct",
      "resolver_type": "alias",
      "target_symbol": "randn",
      "dispatch_order": 0,
      "unit_id": "branch::randn_op.yaml::Randn",
      "unit_name": "Randn",
      "op": "randn",
      "primitive": "Randn",
      "yaml_path": "mindspore/ops/op_def/yaml/randn_op.yaml",
      "coverage": {
        "aclnn": [
          "aclnnInplaceNormal"
        ],
        "infer": true,
        "kbk": true,
        "pyboost": true,
        "bprop": true,
        "bprop_units": []
      }
    }
  ]
}
