{
  "bundle_id": "mindspore.ops.logical_or",
  "bundle_type": "entry",
  "schema_version": "v2",
  "generated_at": "2026-04-17T17:08:56+08:00",
  "entry": {
    "public_api": "mindspore.ops.logical_or",
    "public_surface": "mindspore.ops",
    "public_name": "logical_or",
    "entry_type": "single",
    "source_type": "wrapper",
    "source_path": "mindspore/python/mindspore/ops/function/__init__.py"
  },
  "branches": [
    {
      "route_type": "direct",
      "resolver_type": "alias",
      "target_symbol": "logical_or",
      "dispatch_order": 0,
      "unit_id": "branch::logical_or_op.yaml::LogicalOr",
      "unit_name": "LogicalOr",
      "op": "logical_or",
      "primitive": "LogicalOr",
      "yaml_path": "mindspore/ops/op_def/yaml/logical_or_op.yaml",
      "coverage": {
        "aclnn": [
          "aclnnLogicalOr"
        ],
        "infer": true,
        "kbk": true,
        "pyboost": true,
        "bprop": true,
        "bprop_units": []
      }
    }
  ]
}
