{
  "bundle_id": "mindspore.Tensor.subtract",
  "bundle_type": "entry",
  "schema_version": "v2",
  "generated_at": "2026-04-20T15:15:54+08:00",
  "entry": {
    "public_api": "mindspore.Tensor.subtract",
    "public_surface": "mindspore.Tensor",
    "public_name": "subtract",
    "entry_type": "single",
    "source_type": "api_def",
    "source_path": "mindspore/ops/api_def/subtract.yaml"
  },
  "branches": [
    {
      "route_type": "direct",
      "resolver_type": "py_method",
      "target_symbol": "tensor_subtract",
      "dispatch_order": 0,
      "unit_id": "branch::sub_ext_op.yaml::SubExt",
      "unit_name": "SubExt",
      "op": "sub_ext",
      "primitive": "SubExt",
      "yaml_path": "mindspore/ops/op_def/yaml/sub_ext_op.yaml",
      "coverage": {
        "aclnn": [
          "aclnnSub"
        ],
        "infer": true,
        "kbk": true,
        "pyboost": true,
        "bprop": true,
        "bprop_units": [
          "Cast",
          "Muls",
          "Neg"
        ]
      }
    }
  ]
}
