{
  "bundle_id": "mindspore.Tensor.flip",
  "bundle_type": "entry",
  "schema_version": "v2",
  "generated_at": "2026-04-20T17:24:10+08:00",
  "entry": {
    "public_api": "mindspore.Tensor.flip",
    "public_surface": "mindspore.Tensor",
    "public_name": "flip",
    "entry_type": "single",
    "source_type": "tensor_class",
    "source_path": "mindspore/python/mindspore/common/tensor.py"
  },
  "composite": {
    "resolver_type": "tensor_registry",
    "target_symbol": "flip",
    "impl_path": "mindspore/python/mindspore/ops/function/nn_func.py",
    "components": [
      {
        "component_type": "unit",
        "condition": "",
        "via_symbol": "reverse_v2_impl",
        "unit_id": "branch::reverse_v2_op.yaml::ReverseV2",
        "unit_name": "ReverseV2",
        "unit_type": "branch",
        "op": "reverse_v2",
        "primitive": "ReverseV2",
        "yaml_path": "mindspore/ops/op_def/yaml/reverse_v2_op.yaml",
        "coverage": {
          "aclnn": [
            "aclnnFlip"
          ],
          "infer": true,
          "kbk": true,
          "pyboost": true,
          "bprop": true,
          "bprop_units": [
            "ReverseV2"
          ]
        }
      }
    ]
  }
}
