{
  "bundle_id": "mindspore.ops.inplace_add",
  "bundle_type": "entry",
  "schema_version": "v2",
  "generated_at": "2026-04-17T18:27:04+08:00",
  "entry": {
    "public_api": "mindspore.ops.inplace_add",
    "public_surface": "mindspore.ops",
    "public_name": "inplace_add",
    "entry_type": "composite",
    "source_type": "wrapper",
    "source_path": "mindspore/python/mindspore/ops/function/__init__.py"
  },
  "composite": {
    "resolver_type": "alias",
    "target_symbol": "inplace_add",
    "impl_path": "mindspore/python/mindspore/ops/function/math_func.py",
    "components": []
  }
}
