{
  "bundle_id": "mindspore.ops.soft_margin_loss",
  "bundle_type": "entry",
  "schema_version": "v2",
  "generated_at": "2026-04-17T17:08:56+08:00",
  "entry": {
    "public_api": "mindspore.ops.soft_margin_loss",
    "public_surface": "mindspore.ops",
    "public_name": "soft_margin_loss",
    "entry_type": "single",
    "source_type": "wrapper",
    "source_path": "mindspore/python/mindspore/ops/function/__init__.py"
  },
  "branches": [
    {
      "route_type": "direct",
      "resolver_type": "alias",
      "target_symbol": "soft_margin_loss",
      "dispatch_order": 0,
      "unit_id": "branch::soft_margin_loss_op.yaml::SoftMarginLoss",
      "unit_name": "SoftMarginLoss",
      "op": "soft_margin_loss",
      "primitive": "SoftMarginLoss",
      "yaml_path": "mindspore/ops/op_def/yaml/soft_margin_loss_op.yaml",
      "coverage": {
        "aclnn": [
          "aclnnSoftMarginLoss"
        ],
        "infer": true,
        "kbk": true,
        "pyboost": true,
        "bprop": true,
        "bprop_units": []
      }
    }
  ]
}
