{
  "bundle_id": "mindspore.ops.flatten",
  "bundle_type": "entry",
  "schema_version": "v2",
  "generated_at": "2026-04-20T15:15:54+08:00",
  "entry": {
    "public_api": "mindspore.ops.flatten",
    "public_surface": "mindspore.ops",
    "public_name": "flatten",
    "entry_type": "single",
    "source_type": "wrapper",
    "source_path": "mindspore/python/mindspore/ops/function/__init__.py"
  },
  "branches": [
    {
      "route_type": "direct",
      "resolver_type": "alias",
      "target_symbol": "flatten",
      "dispatch_order": 0,
      "unit_id": "branch::flatten_ext_op.yaml::FlattenExt",
      "unit_name": "FlattenExt",
      "op": "flatten_ext",
      "primitive": "FlattenExt",
      "yaml_path": "mindspore/ops/op_def/yaml/flatten_ext_op.yaml",
      "coverage": {
        "aclnn": [
          "aclnnFlattenExt"
        ],
        "infer": true,
        "kbk": true,
        "pyboost": true,
        "bprop": true,
        "bprop_units": [
          "Reshape",
          "Shape"
        ]
      }
    }
  ]
}
