{
  "bundle_id": "mindspore.mint.empty_like",
  "bundle_type": "entry",
  "schema_version": "v2",
  "generated_at": "2026-04-20T17:24:10+08:00",
  "entry": {
    "public_api": "mindspore.mint.empty_like",
    "public_surface": "mindspore.mint",
    "public_name": "empty_like",
    "entry_type": "single",
    "source_type": "mint_export",
    "source_path": "mindspore/python/mindspore/mint/__init__.py"
  },
  "branches": [
    {
      "route_type": "direct",
      "resolver_type": "alias",
      "target_symbol": "empty_like",
      "dispatch_order": 0,
      "unit_id": "branch::empty_like_op.yaml::EmptyLike",
      "unit_name": "EmptyLike",
      "op": "empty_like",
      "primitive": "EmptyLike",
      "yaml_path": "mindspore/ops/op_def/yaml/empty_like_op.yaml",
      "coverage": {
        "aclnn": [
          "aclnnEmptyLike"
        ],
        "infer": true,
        "kbk": true,
        "pyboost": true,
        "bprop": true,
        "bprop_units": []
      }
    }
  ]
}
