{
  "bundle_id": "mindspore.ops.trace",
  "bundle_type": "entry",
  "schema_version": "v2",
  "generated_at": "2026-04-17T18:27:04+08:00",
  "entry": {
    "public_api": "mindspore.ops.trace",
    "public_surface": "mindspore.ops",
    "public_name": "trace",
    "entry_type": "single",
    "source_type": "wrapper",
    "source_path": "mindspore/python/mindspore/ops/function/__init__.py"
  },
  "branches": [
    {
      "route_type": "direct",
      "resolver_type": "alias",
      "target_symbol": "trace",
      "dispatch_order": 0,
      "unit_id": "branch::trace_op.yaml::Trace",
      "unit_name": "Trace",
      "op": "trace",
      "primitive": "Trace",
      "yaml_path": "mindspore/ops/op_def/yaml/trace_op.yaml",
      "coverage": {
        "aclnn": [],
        "infer": true,
        "kbk": false,
        "pyboost": false,
        "bprop": true,
        "bprop_units": []
      }
    }
  ]
}
