{
  "bundle_id": "mindspore.Tensor.bincount",
  "bundle_type": "entry",
  "schema_version": "v2",
  "generated_at": "2026-04-17T18:27:04+08:00",
  "entry": {
    "public_api": "mindspore.Tensor.bincount",
    "public_surface": "mindspore.Tensor",
    "public_name": "bincount",
    "entry_type": "single",
    "source_type": "api_def",
    "source_path": "mindspore/ops/api_def/bincount.yaml"
  },
  "branches": [
    {
      "route_type": "direct",
      "resolver_type": "py_method",
      "target_symbol": "tensor_bincount",
      "dispatch_order": 0,
      "unit_id": "branch::bincount_ext_op.yaml::BincountExt",
      "unit_name": "BincountExt",
      "op": "bincount_ext",
      "primitive": "BincountExt",
      "yaml_path": "mindspore/ops/op_def/yaml/bincount_ext_op.yaml",
      "coverage": {
        "aclnn": [
          "aclnnBincount",
          "aclnnMax",
          "aclnnMin"
        ],
        "infer": true,
        "kbk": true,
        "pyboost": true,
        "bprop": false,
        "bprop_units": []
      }
    }
  ]
}
