{
  "bundle_id": "mindspore.Tensor.signbit",
  "bundle_type": "entry",
  "schema_version": "v2",
  "generated_at": "2026-04-17T18:27:04+08:00",
  "entry": {
    "public_api": "mindspore.Tensor.signbit",
    "public_surface": "mindspore.Tensor",
    "public_name": "signbit",
    "entry_type": "composite",
    "source_type": "tensor_class",
    "source_path": "mindspore/python/mindspore/common/tensor.py"
  },
  "composite": {
    "resolver_type": "tensor_registry",
    "target_symbol": "signbit",
    "impl_path": "mindspore/python/mindspore/ops/function/math_func.py",
    "components": [
      {
        "component_type": "public_api",
        "condition": "",
        "via_symbol": "less",
        "public_api": "mindspore.ops.less"
      }
    ]
  }
}
