{
  "bundle_id": "mindspore.mint.cdist_",
  "bundle_type": "entry",
  "schema_version": "v2",
  "generated_at": "2026-04-20T17:24:10+08:00",
  "entry": {
    "public_api": "mindspore.mint.cdist_",
    "public_surface": "mindspore.mint",
    "public_name": "cdist_",
    "entry_type": "single",
    "source_type": "mint_export",
    "source_path": "mindspore/python/mindspore/mint/__init__.py"
  },
  "branches": [
    {
      "route_type": "direct",
      "resolver_type": "alias",
      "target_symbol": "cdist",
      "dispatch_order": 0,
      "unit_id": "branch::cdist_op.yaml::Cdist",
      "unit_name": "Cdist",
      "op": "cdist",
      "primitive": "Cdist",
      "yaml_path": "mindspore/ops/op_def/yaml/cdist_op.yaml",
      "coverage": {
        "aclnn": [],
        "infer": true,
        "kbk": false,
        "pyboost": false,
        "bprop": true,
        "bprop_units": [
          "CdistGrad",
          "Transpose"
        ]
      }
    }
  ]
}
