{
  "bundle_id": "mindspore.Tensor.greater_equal",
  "bundle_type": "entry",
  "schema_version": "v2",
  "generated_at": "2026-04-17T18:27:04+08:00",
  "entry": {
    "public_api": "mindspore.Tensor.greater_equal",
    "public_surface": "mindspore.Tensor",
    "public_name": "greater_equal",
    "entry_type": "overload",
    "source_type": "api_def",
    "source_path": "mindspore/ops/api_def/greater_equal.yaml"
  },
  "branches": [
    {
      "route_type": "overload",
      "resolver_type": "py_method",
      "target_symbol": "tensor_greater_equal",
      "dispatch_order": 0,
      "unit_id": "branch::greater_equal_scalar_op.yaml::GreaterEqualScalar",
      "unit_name": "GreaterEqualScalar",
      "op": "greater_equal_scalar",
      "primitive": "GreaterEqualScalar",
      "yaml_path": "mindspore/ops/op_def/yaml/greater_equal_scalar_op.yaml",
      "coverage": {
        "aclnn": [
          "aclnnGeScalar"
        ],
        "infer": true,
        "kbk": true,
        "pyboost": true,
        "bprop": true,
        "bprop_units": []
      }
    },
    {
      "route_type": "overload",
      "resolver_type": "py_method",
      "target_symbol": "tensor_greater_equal",
      "dispatch_order": 1,
      "unit_id": "branch::greater_equal_op.yaml::GreaterEqual",
      "unit_name": "GreaterEqual",
      "op": "greater_equal",
      "primitive": "GreaterEqual",
      "yaml_path": "mindspore/ops/op_def/yaml/greater_equal_op.yaml",
      "coverage": {
        "aclnn": [
          "aclnnGeTensor"
        ],
        "infer": true,
        "kbk": true,
        "pyboost": true,
        "bprop": true,
        "bprop_units": []
      }
    }
  ]
}
