{
  "bundle_id": "mindspore.ops.sum",
  "bundle_type": "entry",
  "schema_version": "v2",
  "generated_at": "2026-04-17T18:27:04+08:00",
  "entry": {
    "public_api": "mindspore.ops.sum",
    "public_surface": "mindspore.ops",
    "public_name": "sum",
    "entry_type": "single",
    "source_type": "wrapper",
    "source_path": "mindspore/python/mindspore/ops/function/__init__.py"
  },
  "branches": [
    {
      "route_type": "direct",
      "resolver_type": "alias",
      "target_symbol": "sum",
      "dispatch_order": 0,
      "unit_id": "branch::sum_ext_op.yaml::SumExt",
      "unit_name": "SumExt",
      "op": "sum_ext",
      "primitive": "SumExt",
      "yaml_path": "mindspore/ops/op_def/yaml/sum_ext_op.yaml",
      "coverage": {
        "aclnn": [
          "aclnnReduceSum"
        ],
        "infer": true,
        "kbk": true,
        "pyboost": true,
        "bprop": true,
        "bprop_units": []
      }
    }
  ]
}
