{
  "bundle_id": "mindspore.Tensor.square",
  "bundle_type": "entry",
  "schema_version": "v2",
  "generated_at": "2026-04-17T17:08:56+08:00",
  "entry": {
    "public_api": "mindspore.Tensor.square",
    "public_surface": "mindspore.Tensor",
    "public_name": "square",
    "entry_type": "single",
    "source_type": "api_def",
    "source_path": "mindspore/ops/api_def/square.yaml"
  },
  "branches": [
    {
      "route_type": "direct",
      "resolver_type": "py_method",
      "target_symbol": "tensor_square",
      "dispatch_order": 0,
      "unit_id": "branch::square_op.yaml::Square",
      "unit_name": "Square",
      "op": "square",
      "primitive": "Square",
      "yaml_path": "mindspore/ops/op_def/yaml/square_op.yaml",
      "coverage": {
        "aclnn": [
          "aclnnMul"
        ],
        "infer": true,
        "kbk": true,
        "pyboost": true,
        "bprop": true,
        "bprop_units": []
      }
    }
  ]
}
