{
  "bundle_id": "mindspore.mint.exp2",
  "bundle_type": "entry",
  "schema_version": "v2",
  "generated_at": "2026-04-20T15:15:54+08:00",
  "entry": {
    "public_api": "mindspore.mint.exp2",
    "public_surface": "mindspore.mint",
    "public_name": "exp2",
    "entry_type": "single",
    "source_type": "mint_export",
    "source_path": "mindspore/python/mindspore/mint/__init__.py"
  },
  "branches": [
    {
      "route_type": "direct",
      "resolver_type": "alias",
      "target_symbol": "exp2",
      "dispatch_order": 0,
      "unit_id": "branch::exp2_op.yaml::Exp2",
      "unit_name": "Exp2",
      "op": "exp2",
      "primitive": "Exp2",
      "yaml_path": "mindspore/ops/op_def/yaml/exp2_op.yaml",
      "coverage": {
        "aclnn": [
          "aclnnExp2"
        ],
        "infer": true,
        "kbk": true,
        "pyboost": true,
        "bprop": true,
        "bprop_units": [
          "Conj",
          "Mul",
          "Muls"
        ]
      }
    }
  ]
}
