{
  "bundle_id": "mindspore.mint.unbind",
  "bundle_type": "entry",
  "schema_version": "v2",
  "generated_at": "2026-04-20T17:24:10+08:00",
  "entry": {
    "public_api": "mindspore.mint.unbind",
    "public_surface": "mindspore.mint",
    "public_name": "unbind",
    "entry_type": "single",
    "source_type": "mint_export",
    "source_path": "mindspore/python/mindspore/mint/__init__.py"
  },
  "branches": [
    {
      "route_type": "direct",
      "resolver_type": "alias",
      "target_symbol": "unbind_ext",
      "dispatch_order": 0,
      "unit_id": "branch::unstack_ext_view_op.yaml::UnstackExtView",
      "unit_name": "UnstackExtView",
      "op": "unstack_ext_view",
      "primitive": "UnstackExtView",
      "yaml_path": "mindspore/ops/op_def/yaml/unstack_ext_view_op.yaml",
      "coverage": {
        "aclnn": [
          "aclnnUnstackExtView"
        ],
        "infer": true,
        "kbk": true,
        "pyboost": true,
        "bprop": true,
        "bprop_units": [
          "StackExt"
        ]
      }
    }
  ]
}
