{
  "bundle_id": "mindspore.ops.hsplit",
  "bundle_type": "entry",
  "schema_version": "v2",
  "generated_at": "2026-04-20T17:24:10+08:00",
  "entry": {
    "public_api": "mindspore.ops.hsplit",
    "public_surface": "mindspore.ops",
    "public_name": "hsplit",
    "entry_type": "composite",
    "source_type": "wrapper",
    "source_path": "mindspore/python/mindspore/ops/function/__init__.py"
  },
  "composite": {
    "resolver_type": "alias",
    "target_symbol": "hsplit",
    "impl_path": "mindspore/python/mindspore/ops/function/array_func.py",
    "components": []
  }
}
